{
  "schemaVersion": "1.0",
  "messageId": "11111111-1111-4111-8111-111111111111",
  "messageType": "EXECUTION_DISPATCH",
  "dispatchId": "22222222-2222-4222-8222-222222222222",
  "occurredAt": "2026-08-28T13:00:00Z",
  "producer": "kaas.scheduler",
  "organizationId": "33333333-3333-4333-8333-333333333333",
  "projectId": "44444444-4444-4444-8444-444444444444",
  "runId": "55555555-5555-4555-8555-555555555555",
  "runVersion": 2,
  "attemptId": "66666666-6666-4666-8666-666666666666",
  "attemptNumber": 1,
  "runSnapshotId": "55555555-5555-4555-8555-555555555555",
  "runSnapshotDigest": "sha256:aaaaaaaaaaaaaaaaaaaaaaaaaaaaaaaaaaaaaaaaaaaaaaaaaaaaaaaaaaaaaaaa",
  "queueDeadlineAt": "2026-08-28T13:05:00Z",
  "payloadDigest": "sha256:bbbbbbbbbbbbbbbbbbbbbbbbbbbbbbbbbbbbbbbbbbbbbbbbbbbbbbbbbbbbbbbb"
}
